[
  {
    "schema_version": "1.0.0",
    "source_document_id": "demo-w2-acme-2025",
    "source_revision_id": "demo-w2-acme-2025-rev-001",
    "document_type": "w2",
    "tax_year": 2025,
    "entered_at": "2026-01-15T12:00:00Z",
    "label": "Demo W-2: Acme Robotics",
    "fields": [
      {
        "source_field_id": "w2.box1.wages",
        "field_number": "1",
        "label": "Wages, tips, other compensation",
        "required": true,
        "value": {
          "amount": 8250000,
          "currency": "USD",
          "scale": 2
        }
      },
      {
        "source_field_id": "w2.box2.federal_income_tax_withheld",
        "field_number": "2",
        "label": "Federal income tax withheld",
        "required": false,
        "value": {
          "amount": 1140000,
          "currency": "USD",
          "scale": 2
        }
      }
    ]
  },
  {
    "schema_version": "1.0.0",
    "source_document_id": "demo-1099-int-example-bank-2025",
    "source_revision_id": "demo-1099-int-example-bank-2025-rev-001",
    "document_type": "1099-int",
    "tax_year": 2025,
    "entered_at": "2026-01-16T12:00:00Z",
    "label": "Demo 1099-INT: Example Bank",
    "fields": [
      {
        "source_field_id": "1099_int.payer.name",
        "field_number": "payer",
        "label": "Payer name",
        "required": true,
        "value": "Example Bank"
      },
      {
        "source_field_id": "1099_int.box1.interest_income",
        "field_number": "1",
        "label": "Interest income",
        "required": true,
        "value": {
          "amount": 43210,
          "currency": "USD",
          "scale": 2
        }
      },
      {
        "source_field_id": "1099_int.box4.federal_income_tax_withheld",
        "field_number": "4",
        "label": "Federal income tax withheld",
        "required": false,
        "value": null
      }
    ]
  }
]
